{
  "doc_type": "lab_pdf",
  "schema_version": "week2.lab_pdf.v1",
  "patient_id": "1",
  "source_document": {
    "source_type": "openemr_document",
    "source_id": "document:labcorp-demo-001",
    "filename": "sample_labcorp.pdf",
    "page_count": 1
  },
  "extraction": {
    "model": "gpt-4o-mini",
    "extracted_at": "2026-06-04T15:30:00Z",
    "confidence": 0.91
  },
  "lab_results": [
    {
      "test_name": "Hemoglobin A1c",
      "value": "7.2",
      "unit": "%",
      "reference_range": "4.0-5.6",
      "collection_date": "2026-05-28",
      "abnormal_flag": "high",
      "source_citation": {
        "source_type": "openemr_document",
        "source_id": "document:labcorp-demo-001",
        "page_or_section": "page 1",
        "field_or_chunk_id": "lab_result_a1c",
        "quote_or_value": "Hemoglobin A1c 7.2 %",
        "bounding_box": {
          "page": 1,
          "x": 72,
          "y": 312,
          "width": 220,
          "height": 18
        }
      }
    }
  ],
  "missing_fields": [],
  "warnings": []
}
